Unnamed: 0,filmid,title,runtime,genre,director,actors,language,country,imdbRating,metascore,imdbVotes,IMDb ID,Worlwide boxoffice,budget,ROI,winner,category
309,tt1302006,the irishman,209 min,"biography, crime, drama",martin scorsese,"robert de niro, al pacino, joe pesci","english, italian, latin, spanish, german",united states,7.8,94.0,"452,725",tt1302006,968853,160000000.0,-0.99,no,best picture
310,tt2584384,jojo rabbit,108 min,"comedy, drama, war",taika waititi,"roman griffin davis, thomasin mckenzie, scarlett johansson","english, german","czech republic, new zealand, united states, germany",7.9,58.0,"463,306",tt2584384,93694707,14000000.0,5.69,no,best picture
311,tt7286456,joker,122 min,"crime, drama, thriller",todd phillips,"joaquin phoenix, robert de niro, zazie beetz","english, german","united states, canada, australia",8.3,59.0,"1,601,600",tt7286456,1078958629,0.0,inf,no,best picture
312,tt3281548,little women,135 min,"drama, romance",greta gerwig,"saoirse ronan, emma watson, florence pugh","english, french",united states,7.8,91.0,"265,900",tt3281548,332103783,15000000.0,21.14,no,best picture
313,tt7653254,marriage story,137 min,"drama, romance",noah baumbach,"adam driver, scarlett johansson, julia greer","english, spanish","united kingdom, united states",7.9,94.0,"358,019",tt7653254,333686,18000000.0,-0.98,no,best picture
314,tt8579674,1917,119 min,"action, drama, war",sam mendes,"dean-charles chapman, george mackay, daniel mays","english, french, german","united kingdom, united states, india, spain, canada",8.2,78.0,"725,123",tt8579674,446064352,95000000.0,3.7,no,best picture
315,tt7131622,once upon a time... in hollywood,161 min,"comedy, drama",quentin tarantino,"leonardo dicaprio, brad pitt, margot robbie","english, italian, spanish, german","united states, united kingdom, china",7.6,84.0,"898,601",tt7131622,392105159,90000000.0,3.36,no,best picture
316,tt7146812,onward,102 min,"animation, adventure, comedy",dan scanlon,"tom holland, chris pratt, julia louis-dreyfus",english,"united states, japan",7.4,61.0,"177,113",tt7146812,141940042,200000000.0,-0.29,no,animated feature film
317,tt7488208,over the moon,95 min,"animation, adventure, comedy","glen keane, john kahrs","glen keane, brycen hall, ruthie ann miles",english,"china, united states",6.3,60.0,"25,783",tt7488208,0,38000000.0,-1.0,no,animated feature film
318,tt6193408,a shaun the sheep movie: farmageddon,86 min,"animation, adventure, comedy","will becher, richard phelan","justin fletcher, john sparkes, amalia vitale",english,"united kingdom, france",6.8,79.0,"16,356",tt6193408,43133089,25000000.0,0.73,no,animated feature film
319,tt2948372,soul,100 min,"animation, adventure, comedy","pete docter, kemp powers","jamie foxx, tina fey, graham norton","english, korean, inuktitut",united states,8.0,83.0,"407,528",tt2948372,121977511,150000000.0,-0.19,yes,animated feature film
320,tt5198068,wolfwalkers,103 min,"animation, action, adventure","tomm moore, ross stewart","honor kneafsey, eva whittaker, sean bean","english, irish gaelic","ireland, luxembourg, france, china, united states",8.0,87.0,"40,714",tt5198068,1310720,10000000.0,-0.87,no,animated feature film
321,tt10288566,another round,117 min,drama,thomas vinterberg,"mads mikkelsen, thomas bo larsen, magnus millang","danish, swedish, french, english, russian","denmark, sweden, netherlands, belgium, france",7.7,79.0,"206,926",tt10288566,12745392,4000000.0,2.19,yes,international feature film
322,tt9586294,better days,135 min,"crime, drama, romance",derek tsang,"dongyu zhou, jackson yee, fang yin","mandarin, english","hong kong, china, united kingdom",7.6,83.0,"15,299",tt9586294,227313644,9000000.0,24.26,no,international feature film
323,tt10706602,collective,109 min,"documentary, crime",alexander nanau,"dan alexandru condrea, liviu iolu, razvan lutac","romanian, english","romania, luxembourg, germany",8.1,95.0,"13,684",tt10706602,200041,1000000.0,-0.8,no,international feature film
324,tt10360862,the man who sold his skin,104 min,drama,kaouther ben hania,"yahya mahayni, dea liane, koen de bouw","arabic, english, french, flemish","tunisia, france, belgium, germany, sweden, qatar, cyprus, turkey",6.9,64.0,"7,358",tt10360862,227290,1500000.0,-0.85,no,international feature film
325,tt8633462,"quo vadis, aida?",101 min,"drama, history, war",jasmila zbanic,"jasna djuricic, izudin bajrovic, boris ler","serbo-croatian, bosnian, english, dutch, serbian","bosnia and herzegovina, austria, romania, netherlands, germany, poland, france, turkey, norway, croatia, sweden, montenegro, italy",8.0,97.0,"40,198",tt8633462,813253,2300000.0,-0.65,no,international feature film
326,tt10272386,the father,97 min,"drama, mystery",florian zeller,"anthony hopkins, olivia colman, mark gatiss",english,"united kingdom, france, united states",8.2,88.0,"211,445",tt10272386,24048935,6000000.0,3.01,no,best picture
327,tt9784798,judas and the black messiah,126 min,"biography, drama, history",shaka king,"lakeith stanfield, daniel kaluuya, jesse plemons",english,united states,7.4,84.0,"94,432",tt9784798,7478009,26000000.0,-0.71,no,best picture
328,tt10618286,mank,131 min,"biography, drama",david fincher,"gary oldman, amanda seyfried, lily collins","english, german, latin",united states,6.8,79.0,"84,608",tt10618286,0,0.0,,no,best picture
329,tt10633456,minari,115 min,drama,lee isaac chung,"steven yeun, han ye-ri, alan kim","korean, english",united states,7.4,89.0,"101,764",tt10633456,15288578,2000000.0,6.64,no,best picture
330,tt9770150,nomadland,107 min,drama,chloé zhao,"frances mcdormand, david strathairn, linda may",english,united states,7.3,87.0,"189,601",tt9770150,39458207,5000000.0,6.89,yes,best picture
331,tt9620292,promising young woman,113 min,"crime, drama, mystery",emerald fennell,"carey mulligan, bo burnham, alison brie",english,"united kingdom, united states",7.5,72.0,"224,400",tt9620292,18854166,0.0,inf,no,best picture
332,tt5363618,sound of metal,120 min,"drama, music",darius marder,"riz ahmed, olivia cooke, paul raci","english, american sign , french, persian",united states,7.7,82.0,"157,577",tt5363618,516520,5400000.0,-0.9,no,best picture
333,tt1070874,the trial of the chicago 7,129 min,"drama, history, thriller",aaron sorkin,"eddie redmayne, alex sharp, sacha baron cohen","english, latin, french","united states, united kingdom, india",7.7,76.0,"198,007",tt1070874,0,35000000.0,-1.0,no,best picture
334,tt2953050,encanto,102 min,"animation, comedy, family","jared bush, byron howard, charise castro smith","stephanie beatriz, maría cecilia botero, john leguizamo","english, spanish",united states,7.2,75.0,"280,799",tt2953050,261284192,120000000.0,1.18,yes,animated feature film
335,tt8430054,flee,89 min,"documentary, animation, biography",jonas poher rasmussen,"daniel karimyar, fardin mijdzadeh, milad eskandari","spanish, danish, english, dari, russian, swedish","denmark, france, norway, sweden, netherlands, united kingdom, united states, finland, italy, spain, estonia, slovenia, belgium",7.9,91.0,"20,187",tt8430054,711676,3000000.0,-0.76,no,animated feature film
335,tt8430054,flee,89 min,"documentary, animation, biography",jonas poher rasmussen,"daniel karimyar, fardin mijdzadeh, milad eskandari","spanish, danish, english, dari, russian, swedish","denmark, france, norway, sweden, netherlands, united kingdom, united states, finland, italy, spain, estonia, slovenia, belgium",7.9,91.0,"20,187",tt8430054,711676,3000000.0,-0.76,no,international feature film
336,tt12801262,luca,95 min,"animation, adventure, comedy",enrico casarosa,"jacob tremblay, jack dylan grazer, emma berman","english, italian",united states,7.4,71.0,"206,563",tt12801262,51074773,50000000.0,0.02,no,animated feature film
337,tt7979580,the mitchells vs. the machines,114 min,"animation, adventure, comedy","michael rianda, jeff rowe","abbi jacobson, danny mcbride, maya rudolph",english,"united states, hong kong, canada",7.6,81.0,"132,243",tt7979580,0,85000000.0,-1.0,no,animated feature film
338,tt5109280,raya and the last dragon,107 min,"animation, action, adventure","don hall, carlos lópez estrada, paul briggs","kelly marie tran, awkwafina, gemma chan",english,united states,7.3,74.0,"179,360",tt5109280,130423032,0.0,inf,no,animated feature film
339,tt14039582,drive my car,179 min,drama,ryûsuke hamaguchi,"hidetoshi nishijima, tôko miura, reika kirishima","japanese, english, korean sign , korean, mandarin, tagalog, indonesian, german, malay",japan,7.5,91.0,"71,528",tt14039582,15357339,2000000.0,6.68,yes,international feature film
339,tt14039582,drive my car,179 min,drama,ryûsuke hamaguchi,"hidetoshi nishijima, tôko miura, reika kirishima","japanese, english, korean sign , korean, mandarin, tagalog, indonesian, german, malay",japan,7.5,91.0,"71,528",tt14039582,15357339,2000000.0,6.68,no,best picture
340,tt12680684,the hand of god,130 min,drama,paolo sorrentino,"filippo scotti, toni servillo, teresa saponangelo","italian, neapolitan","italy, united states",7.3,76.0,"50,805",tt12680684,167909,5000000.0,-0.97,no,international feature film
341,tt10189300,lunana: a yak in the classroom,110 min,"drama, family",pawo choyning dorji,"sherab dorji, ugyen norbu lhendup, kelden lhamo gurung","dzongkha, english","bhutan, china",7.5,76.0,"7,304",tt10189300,1990014,200.0,9949.07,no,international feature film
342,tt10370710,the worst person in the world,128 min,"comedy, drama, romance",joachim trier,"renate reinsve, anders danielsen lie, herbert nordrum",norwegian,"norway, france, sweden, denmark",7.7,91.0,"110,779",tt10370710,12687507,5000000.0,1.54,no,international feature film
343,tt12789558,belfast,98 min,"biography, drama, romance",kenneth branagh,"jude hill, lewis mcaskie, caitríona balfe",english,united kingdom,7.2,75.0,"96,559",tt12789558,49158709,20000000.0,1.46,no,best picture
344,tt10366460,coda,111 min,"comedy, drama, music",sian heder,"emilia jones, marlee matlin, troy kotsur","american sign , english","france, canada, united states",8.0,72.0,"177,380",tt10366460,1905058,10000000.0,-0.81,yes,best picture
345,tt11286314,don't look up,138 min,"comedy, drama, sci-fi",adam mckay,"leonardo dicaprio, jennifer lawrence, meryl streep",english,"united states, canada",7.2,49.0,"639,219",tt11286314,791863,0.0,inf,no,best picture
346,tt1160419,dune: part one,155 min,"action, adventure, drama",denis villeneuve,"timothée chalamet, rebecca ferguson, zendaya","english, mandarin","united states, canada",8.0,74.0,"951,653",tt1160419,410668018,165000000.0,1.49,no,best picture
347,tt9620288,king richard,144 min,"biography, drama, sport",reinaldo marcus green,"will smith, aunjanue ellis-taylor, jon bernthal","english, spanish","united states, australia",7.5,76.0,"145,812",tt9620288,39529285,50000000.0,-0.21,no,best picture
348,tt11271038,licorice pizza,133 min,"comedy, drama, romance",paul thomas anderson,"alana haim, cooper hoffman, sean penn","english, japanese, spanish","united states, canada",7.1,90.0,"147,992",tt11271038,33276075,40000000.0,-0.17,no,best picture
349,tt7740496,nightmare alley,150 min,"crime, drama, thriller",guillermo del toro,"bradley cooper, cate blanchett, toni collette","english, french","united states, mexico, canada",7.0,70.0,"175,050",tt7740496,39629195,60000000.0,-0.34,no,best picture
350,tt10293406,the power of the dog,126 min,"drama, western",jane campion,"benedict cumberbatch, kirsten dunst, jesse plemons","english, shoshoni, italian, french","new zealand, united kingdom, canada, australia, united states",6.8,89.0,"199,853",tt10293406,271009,39000000.0,-0.99,no,best picture
351,tt3581652,west side story,156 min,"crime, drama, musical",steven spielberg,"ansel elgort, rachel zegler, ariana debose","english, spanish","united states, canada, united kingdom",7.1,85.0,"98,656",tt3581652,76016171,6000000.0,11.67,no,best picture
352,tt1488589,guillermo del toro's pinocchio,117 min,"animation, adventure, drama","guillermo del toro, mark gustafson","ewan mcgregor, david bradley, gregory mann","english, italian","united states, mexico, france",7.6,79.0,"119,622",tt1488589,109846,35000000.0,-1.0,yes,animated feature film
353,tt15339456,marcel the shell with shoes on,90 min,"animation, comedy, drama",dean fleischer camp,"jenny slate, dean fleischer camp, isabella rossellini",english,united states,7.6,80.0,"30,360",tt15339456,6909209,6300000.0,0.1,no,animated feature film
354,tt3915174,puss in boots: the last wish,102 min,"animation, action, adventure","joel crawford, januel mercado","antonio banderas, salma hayek, harvey guillén","english, spanish","united states, japan",7.8,73.0,"202,212",tt3915174,480466413,90000000.0,4.34,no,animated feature film
355,tt9288046,the sea beast,115 min,"animation, action, adventure",chris williams,"karl urban, zaris-angel hator, jared harris","english, persian",united states,7.0,74.0,"62,092",tt9288046,0,70000000.0,-1.0,no,animated feature film
356,tt8097030,turning red,100 min,"animation, adventure, comedy",domee shi,"rosalie chiang, sandra oh, ava morse","english, cantonese, korean","united states, canada",6.9,83.0,"163,400",tt8097030,21813358,175000000.0,-0.88,no,animated feature film
357,tt1016150,all quiet on the western front,148 min,"drama, history, war",edward berger,"felix kammerer, albrecht schuch, aaron hilmer","german, french","germany, united states, united kingdom",7.8,76.0,"272,532",tt1016150,0,0.0,,yes,international feature film
357,tt1016150,all quiet on the western front,148 min,"drama, history, war",edward berger,"felix kammerer, albrecht schuch, aaron hilmer","german, french","germany, united states, united kingdom",7.8,76.0,"272,532",tt1016150,0,0.0,,no,best picture
358,tt15301048,"argentina, 1985",140 min,"biography, crime, drama",santiago mitre,"ricardo darín, gina mastronicola, francisco bertín","spanish, english","argentina, united kingdom, united states",7.6,78.0,"33,894",tt15301048,905893,10000000.0,-0.91,no,international feature film
359,tt9660502,close,104 min,drama,lukas dhont,"eden dambrine, gustav de waele, émilie dequenne","french, flemish, dutch, english","belgium, netherlands, france",7.8,81.0,"40,916",tt9660502,5216044,3000000.0,0.74,no,international feature film
360,tt19652910,eo,88 min,drama,jerzy skolimowski,"hola, tako, marietta","polish, italian, english, french, spanish","poland, italy",6.7,85.0,"15,323",tt19652910,2585252,2000000.0,0.29,no,international feature film
361,tt15109082,the quiet girl,95 min,drama,colm bairéad,"carrie crowley, andrew bennett, catherine clinch","irish gaelic, english, gaelic",ireland,7.7,89.0,"25,030",tt15109082,6785404,1000000.0,5.79,no,international feature film
362,tt1630029,avatar: the way of water,192 min,"action, adventure, fantasy",james cameron,"sam worthington, zoe saldaña, sigourney weaver",english,united states,7.5,67.0,"529,170",tt1630029,2320250281,460000000.0,4.04,no,best picture
363,tt11813216,the banshees of inisherin,114 min,"comedy, drama",martin mcdonagh,"colin farrell, brendan gleeson, kerry condon","english, latin","ireland, united kingdom, united states",7.7,87.0,"277,451",tt11813216,50250625,20000000.0,1.51,no,best picture
364,tt3704428,elvis,159 min,"biography, drama, music",baz luhrmann,"tom hanks, austin butler, olivia dejonge",english,"united states, australia",7.3,64.0,"247,008",tt3704428,288670284,85000000.0,2.4,no,best picture
365,tt6710474,everything everywhere all at once,139 min,"action, adventure, comedy","daniel kwan, daniel scheinert","michelle yeoh, stephanie hsu, jamie lee curtis","english, mandarin, cantonese",united states,7.8,81.0,"570,853",tt6710474,143412671,25000000.0,4.74,yes,best picture
366,tt14208870,the fabelmans,151 min,drama,steven spielberg,"michelle williams, gabriel labelle, paul dano",english,"united states, india",7.5,85.0,"127,065",tt14208870,45614213,40000000.0,0.14,no,best picture
367,tt14444726,tár,158 min,"drama, music",todd field,"cate blanchett, noémie merlant, nina hoss","english, german, filipino, french",united states,7.4,93.0,"100,593",tt14444726,29177163,35000000.0,-0.17,no,best picture
368,tt1745960,top gun: maverick,130 min,"action, drama",joseph kosinski,"tom cruise, jennifer connelly, miles teller",english,united states,8.2,78.0,"754,892",tt1745960,1495696292,170000000.0,7.8,no,best picture
369,tt7322224,triangle of sadness,147 min,"comedy, drama",ruben östlund,"thobias thorwid, harris dickinson, charlbi dean","english, swedish, german, french, greek, tagalog, akan","united kingdom, sweden, germany, mexico, france, turkey, denmark, united states, switzerland, greece",7.3,63.0,"201,623",tt7322224,26195743,15600000.0,0.68,no,best picture
370,tt13669038,women talking,104 min,drama,sarah polley,"rooney mara, claire foy, jessie buckley",english,united states,6.9,77.0,"44,731",tt13669038,9276103,10000000.0,-0.07,no,best picture
371,tt6587046,the boy and the heron,124 min,"animation, adventure, drama",hayao miyazaki,"soma santoki, masaki suda, kô shibasaki",japanese,japan,7.4,91.0,"87,143",tt6587046,282422186,25000000.0,10.3,yes,animated feature film
372,tt15789038,elemental,101 min,"animation, adventure, comedy",peter sohn,"leah lewis, mamoudou athie, ronnie del carmen",english,united states,7.0,58.0,"149,083",tt15789038,496444308,175000000.0,1.84,no,animated feature film
373,tt19500164,nimona,101 min,"animation, action, adventure","nick bruno, troy quane","chloë grace moretz, riz ahmed, eugene lee yang",english,"united states, united kingdom, france",7.5,75.0,"55,377",tt19500164,0,0.0,,no,animated feature film
374,tt13429870,robot dreams,103 min,"animation, comedy, drama",pablo berger,ivan labanda,spanish,"spain, france",7.6,87.0,"17,944",tt13429870,4656497,50000000.0,-0.91,no,animated feature film
375,tt9362722,spider-man: across the spider-verse,140 min,"animation, action, adventure","joaquim dos santos, kemp powers, justin k. thompson","shameik moore, hailee steinfeld, brian tyree henry",english,united states,8.5,86.0,"434,719",tt9362722,690824738,100000000.0,5.91,no,animated feature film
376,tt14225838,io capitano,121 min,drama,matteo garrone,"seydou sarr, moustapha fall, issaka sawadogo","wolof, french, arabic, english","italy, belgium, france",7.6,79.0,"15,832",tt14225838,7636951,3000000.0,1.55,no,international feature film
377,tt27503384,perfect days,124 min,drama,wim wenders,"kôji yakusho, tokio emoto, arisa nakano","japanese, english","japan, germany",7.9,80.0,"82,487",tt27503384,25660952,4000000.0,5.42,no,international feature film
378,tt16277242,society of the snow,144 min,"adventure, biography, drama",j.a. bayona,"enzo vogrincic, agustín pardella, matías recalt",spanish,spain,7.8,72.0,"156,565",tt16277242,1281,10000000.0,-1.0,no,international feature film
379,tt26612950,the teachers' lounge,98 min,drama,ilker çatak,"leonie benesch, anne-kathrin gummich, rafael stachowiak","german, turkish, polish, english","germany, united states",7.4,82.0,"25,330",tt26612950,5707442,4000000.0,0.43,no,international feature film
380,tt7160372,the zone of interest,105 min,"drama, history, war",jonathan glazer,"christian friedel, sandra hüller, johann karthaus","german, polish, yiddish","united kingdom, poland, united states",7.3,92.0,"129,931",tt7160372,52631884,8000000.0,5.58,yes,international feature film
380,tt7160372,the zone of interest,105 min,"drama, history, war",jonathan glazer,"christian friedel, sandra hüller, johann karthaus","german, polish, yiddish","united kingdom, poland, united states",7.3,92.0,"129,931",tt7160372,52631884,8000000.0,5.58,no,best picture
381,tt23561236,american fiction,117 min,"comedy, drama",cord jefferson,"jeffrey wright, skyler wright, john ales",english,united states,7.5,81.0,"110,103",tt23561236,22483370,7000000.0,2.21,no,best picture
382,tt17009710,anatomy of a fall,151 min,"crime, drama, thriller",justine triet,"sandra hüller, swann arlaud, milo machado-graner","french, english",france,7.7,86.0,"160,897",tt17009710,36051506,8000000.0,3.51,no,best picture
383,tt1517268,barbie,114 min,"adventure, comedy, fantasy",greta gerwig,"margot robbie, ryan gosling, issa rae","english, spanish","united states, united kingdom",6.8,80.0,"596,493",tt1517268,1447038421,145000000.0,8.98,no,best picture
384,tt14849194,the holdovers,133 min,"comedy, drama",alexander payne,"paul giamatti, da'vine joy randolph, dominic sessa",english,united states,7.9,82.0,"196,289",tt14849194,45737958,25000000.0,0.83,no,best picture
385,tt5537002,killers of the flower moon,206 min,"crime, drama, history",martin scorsese,"leonardo dicaprio, robert de niro, lily gladstone","english, osage, latin, french",united states,7.6,89.0,"276,504",tt5537002,158772599,200000000.0,-0.21,no,best picture
386,tt5535276,maestro,129 min,"biography, drama, history",bradley cooper,"carey mulligan, bradley cooper, matt bomer",english,"united states, canada",6.5,77.0,"67,033",tt5535276,383532,0.0,inf,no,best picture
387,tt15398776,oppenheimer,180 min,"biography, drama, history",christopher nolan,"cillian murphy, emily blunt, matt damon","english, german, italian, dutch","united states, united kingdom",8.3,90.0,"878,936",tt15398776,975811333,100000000.0,8.76,yes,best picture
388,tt13238346,past lives,105 min,"drama, romance",celine song,"greta lee, teo yoo, john magaro","korean, english, mandarin, french","united states, south korea",7.8,94.0,"143,168",tt13238346,42677159,2000000.0,20.34,no,best picture
389,tt14230458,poor things,141 min,"comedy, drama, romance",yorgos lanthimos,"emma stone, mark ruffalo, willem dafoe","english, french, portuguese","ireland, united kingdom, united states, hungary",7.8,88.0,"337,982",tt14230458,117625455,50000000.0,1.35,no,best picture
390,tt4772188,flow,85 min,"animation, adventure, family",gints zilbalodis,,,"latvia, belgium, france",7.9,87.0,"70,276",tt4772188,29905187,5000000.0,4.98,yes,animated feature film
390,tt4772188,flow,85 min,"animation, adventure, family",gints zilbalodis,,,"latvia, belgium, france",7.9,87.0,"70,276",tt4772188,29905187,5000000.0,4.98,no,international feature film
391,tt22022452,inside out 2,96 min,"animation, adventure, comedy",kelsey mann,"amy poehler, maya hawke, kensington tallman","english, french, spanish",united states,7.5,73.0,"211,354",tt22022452,1698863816,200000000.0,7.49,no,animated feature film
392,tt23770030,memoir of a snail,95 min,"animation, drama",adam elliot,"jacki weaver, sarah snook, charlotte belsey","english, french",australia,7.8,83.0,"7,172",tt23770030,7566626,1000000.0,6.57,no,animated feature film
393,tt17163970,wallace & gromit: vengeance most fowl,82 min,"animation, adventure, comedy","merlin crossingham, nick park","ben whitehead, peter kay, lauren patel",english,united kingdom,7.5,83.0,"32,826",tt17163970,191452,30000000.0,-0.99,no,animated feature film
394,tt29623480,the wild robot,102 min,"animation, sci-fi",chris sanders,"lupita nyong'o, pedro pascal, kit connor","english, german, french, spanish, swahili, japanese","united states, japan",8.2,85.0,"151,636",tt29623480,333165945,40000000.0,7.33,no,animated feature film
395,tt20221436,emilia pérez,132 min,"comedy, crime, drama",jacques audiard,"zoe saldaña, karla sofía gascón, selena gomez","spanish, english","france, mexico, belgium",5.4,70.0,"80,230",tt20221436,16298763,3000000.0,4.43,no,international feature film
395,tt20221436,emilia pérez,132 min,"comedy, crime, drama",jacques audiard,"zoe saldaña, karla sofía gascón, selena gomez","spanish, english","france, mexico, belgium",5.4,70.0,"80,230",tt20221436,16298763,3000000.0,4.43,no,best picture
396,tt10236164,the girl with the needle,123 min,"crime, drama, history",magnus von horn,"vic carmen sonne, trine dyrholm, besir zeciri",danish,"denmark, poland, sweden, france, belgium",7.5,82.0,"13,953",tt10236164,530171,2000000.0,-0.73,no,international feature film
397,tt14961016,i'm still here,137 min,"biography, drama, history",walter salles,"fernanda torres, fernanda montenegro, selton mello",portuguese,"brazil, france",8.6,85.0,"86,641",tt14961016,35937628,0.0,inf,yes,international feature film
397,tt14961016,i'm still here,137 min,"biography, drama, history",walter salles,"fernanda torres, fernanda montenegro, selton mello",portuguese,"brazil, france",8.6,85.0,"86,641",tt14961016,35937628,0.0,inf,no,best picture
398,tt32178949,the seed of the sacred fig,167 min,"crime, drama, thriller",mohammad rasoulof,"soheila golestani, missagh zareh, setareh maleki",persian,"france, germany",7.6,85.0,"4,554",tt32178949,6532783,1500000.0,3.36,no,international feature film
399,tt28607951,anora,139 min,"comedy, drama, romance",sean baker,"mikey madison, paul weissman, yura borisov","english, russian, armenian",united states,7.5,91.0,"176,420",tt28607951,59568145,2000000.0,28.78,yes,best picture
400,tt8999762,the brutalist,216 min,drama,brady corbet,"adrien brody, felicity jones, guy pearce","english, hungarian, italian, hebrew, yiddish, russian, french","united states, united kingdom, canada",7.4,90.0,"78,828",tt8999762,50257472,12000000.0,3.19,no,best picture
401,tt11563598,a complete unknown,141 min,"biography, drama, music",james mangold,"timothée chalamet, edward norton, elle fanning",english,united states,7.7,70.0,"74,164",tt11563598,140263060,2000000.0,69.13,no,best picture
402,tt20215234,conclave,120 min,"drama, thriller",edward berger,"ralph fiennes, stanley tucci, john lithgow","english, italian, spanish, latin","united kingdom, united states",7.4,79.0,"147,765",tt20215234,119109751,10000000.0,10.91,no,best picture
403,tt15239678,dune: part two,166 min,"action, adventure, drama",denis villeneuve,"timothée chalamet, zendaya, rebecca ferguson",english,"united states, canada, united arab emirates, hungary, italy, new zealand, jordan, gambia",8.5,79.0,"626,461",tt15239678,714644358,200000000.0,2.57,no,best picture
404,tt23055660,nickel boys,140 min,drama,ramell ross,"ethan herisse, brandon wilson, aunjanue ellis-taylor",english,united states,7.0,91.0,"16,693",tt23055660,3016380,4000000.0,-0.25,no,best picture
