Unnamed: 0,filmid,title,runtime,genre,director,actors,language,country,imdbRating,metascore,imdbVotes,IMDb ID,Worlwide boxoffice,budget,ROI,winner,category
207,tt2245084,big hero 6,102 min,"animation, action, adventure","don hall, chris williams","ryan potter, scott adsit, jamie chung",english,united states,7.8,74.0,"527,175",tt2245084,657870525,165000000.0,2.99,yes,animated feature film
208,tt0787474,the boxtrolls,96 min,"animation, adventure, comedy","graham annable, anthony stacchi","ben kingsley, jared harris, nick frost",english,"united states, canada",6.8,61.0,"62,785",tt0787474,108255770,60000000.0,0.8,no,animated feature film
209,tt1646971,how to train your dragon 2,102 min,"animation, action, adventure",dean deblois,"jay baruchel, cate blanchett, gerard butler",english,"united states, india",7.8,77.0,"380,482",tt1646971,621537519,145000000.0,3.29,no,animated feature film
210,tt1865505,song of the sea,93 min,"animation, adventure, drama",tomm moore,"david rawle, brendan gleeson, lisa hannigan","english, irish gaelic","ireland, denmark, belgium, france, luxembourg",8.0,85.0,"65,736",tt1865505,4228034,0.0,inf,no,animated feature film
211,tt2576852,the tale of the princess kaguya,137 min,"animation, drama, family",isao takahata,"chloë grace moretz, james caan, mary steenburgen",japanese,japan,8.0,89.0,"58,154",tt2576852,24751400,49000000.0,-0.49,no,animated feature film
212,tt2718492,ida,82 min,drama,pawel pawlikowski,"agata kulesza, agata trzebuchowska, dawid ogrodnik","polish, latin, french","poland, denmark, france, united kingdom",7.4,91.0,"61,665",tt2718492,11156836,2600000.0,3.29,yes,foreign language film
213,tt2802154,leviathan,140 min,"crime, drama",andrey zvyagintsev,"aleksey serebryakov, elena lyadova, roman madyanov",russian,russia,7.6,92.0,"57,739",tt2802154,4439481,0.0,inf,no,foreign language film
214,tt2991224,tangerines,87 min,"drama, war",zaza urushadze,"lembit ulfsak, elmo nüganen, giorgi nakashidze","estonian, russian, georgian","estonia, georgia",8.1,73.0,"50,317",tt2991224,1024132,1500000.0,-0.32,no,foreign language film
215,tt3409392,timbuktu,96 min,"drama, war",abderrahmane sissako,"ibrahim ahmed, abel jafri, toulou kiki","french, arabic, bambara, english, songhay, tamashek","france, mauritania, qatar",7.1,92.0,"18,617",tt3409392,7179391,2500000.0,1.87,no,foreign language film
216,tt3011894,wild tales,122 min,"comedy, drama, thriller",damián szifron,"darío grandinetti, maría marull, mónica villa",spanish,"argentina, spain, france, united kingdom",8.1,77.0,"225,049",tt3011894,31478893,3000000.0,9.49,no,foreign language film
217,tt2179136,american sniper,133 min,"action, biography, drama",clint eastwood,"bradley cooper, sienna miller, kyle gallner","english, arabic",united states,7.3,73.0,"548,828",tt2179136,547659020,58000000.0,8.44,no,best picture
218,tt2562232,birdman or (the unexpected virtue of ignorance),119 min,"comedy, drama",alejandro g. iñárritu,"michael keaton, zach galifianakis, edward norton",english,united states,7.7,87.0,"681,128",tt2562232,103215094,18000000.0,4.73,yes,best picture
219,tt1065073,boyhood,165 min,drama,richard linklater,"ellar coltrane, patricia arquette, ethan hawke","english, spanish, ukrainian, arabic",united states,7.9,100.0,"373,700",tt1065073,48137666,4000000.0,11.03,no,best picture
220,tt2278388,the grand budapest hotel,99 min,"comedy, drama",wes anderson,"ralph fiennes, f. murray abraham, mathieu amalric","english, french, german","united states, germany",8.1,88.0,"925,564",tt2278388,174567384,31000000.0,4.63,no,best picture
221,tt2084970,the imitation game,114 min,"biography, drama, thriller",morten tyldum,"benedict cumberbatch, keira knightley, matthew goode","english, german",united states,8.0,71.0,"842,688",tt2084970,233555708,15000000.0,14.57,no,best picture
222,tt1020072,selma,128 min,"biography, drama, history",ava duvernay,"david oyelowo, carmen ejogo, oprah winfrey","english, portuguese","united states, united kingdom, france",7.5,79.0,"96,889",tt1020072,67782762,20000000.0,2.39,no,best picture
223,tt2980516,the theory of everything,123 min,"biography, drama, romance",james marsh,"eddie redmayne, felicity jones, tom prior","english, french, ukrainian","united kingdom, japan, united states",7.7,71.0,"496,044",tt2980516,123726688,15000000.0,7.25,no,best picture
224,tt2582802,whiplash,106 min,"drama, music",damien chazelle,"miles teller, j.k. simmons, melissa benoist",english,united states,8.5,89.0,"1,072,121",tt2582802,50360880,3300000.0,14.26,no,best picture
225,tt2401878,anomalisa,90 min,"animation, comedy, drama","duke johnson, charlie kaufman","david thewlis, jennifer jason leigh, tom noonan","english, italian, japanese","united kingdom, united states",7.2,88.0,"76,703",tt2401878,5659286,8000000.0,-0.29,no,animated feature film
226,tt3183630,the boy and the world,80 min,"animation, adventure, family",alê abreu,"vinicius garcia, marco aurélio campos, lu horta",portuguese,brazil,7.5,80.0,"7,733",tt3183630,277143,2000000.0,-0.86,no,animated feature film
227,tt2096673,inside out,95 min,"animation, adventure, comedy","pete docter, ronnie del carmen","amy poehler, bill hader, lewis black","english, portuguese, latvian",united states,8.1,94.0,"862,834",tt2096673,859076254,0.0,inf,yes,animated feature film
228,tt2872750,shaun the sheep movie,85 min,"animation, adventure, comedy","mark burton, richard starzak","justin fletcher, john sparkes, omid djalili","none, english","united kingdom, france",7.3,81.0,"45,000",tt2872750,110549295,25000000.0,3.42,no,animated feature film
229,tt3398268,when marnie was there,103 min,"animation, drama, family",hiromasa yonebayashi,"sara takatsuki, kasumi arimura, nanako matsushima",japanese,japan,7.6,72.0,"50,411",tt3398268,35012681,20000000.0,0.75,no,animated feature film
230,tt4285496,embrace of the serpent,125 min,"adventure, biography, drama",ciro guerra,"nilbio torres, jan bijvoet, antonio bolívar","spanish, portuguese, aboriginal, german, catalan, latin, english","colombia, mexico, venezuela, argentina, spain, netherlands",7.8,82.0,"25,201",tt4285496,3217212,1200000.0,1.68,no,foreign language film
231,tt3966404,mustang,97 min,drama,deniz gamze ergüven,"günes sensoy, doga zeynep doguslu, tugba sunguroglu",turkish,"france, germany, turkey, qatar",7.6,83.0,"41,684",tt3966404,5274664,1400000.0,2.77,no,foreign language film
232,tt3808342,son of saul,107 min,"drama, war",lászló nemes,"géza röhrig, levente molnár, urs rechn","hungarian, yiddish, german, russian, polish, french, greek, slovak, hebrew","hungary, france",7.4,91.0,"52,784",tt3808342,6659121,1500000.0,3.44,yes,foreign language film
233,tt3170902,theeb,100 min,"adventure, drama, thriller",naji abu nowar,"jacir eid al-hwietat, hussein salameh al-sweilhiyeen, hassan mutlag al-maraiyeh","arabic, english, turkish","jordan, united kingdom, qatar, united arab emirates",7.2,80.0,"11,706",tt3170902,768449,535000.0,0.44,no,foreign language film
234,tt3830162,a war,115 min,"crime, drama, thriller",tobias lindholm,"pilou asbæk, tuva novotny, søren malling","danish, arabic, english","denmark, france",7.0,81.0,"11,376",tt3830162,1114663,5000000.0,-0.78,no,foreign language film
235,tt1596363,the big short,130 min,"biography, comedy, drama",adam mckay,"christian bale, steve carell, ryan gosling",english,united states,7.8,81.0,"509,381",tt1596363,133440870,28000000.0,3.77,no,best picture
236,tt3682448,bridge of spies,142 min,"drama, history, thriller",steven spielberg,"tom hanks, mark rylance, alan alda","english, german, russian","united states, india, germany",7.6,81.0,"336,285",tt3682448,165478348,40000000.0,3.14,no,best picture
237,tt2381111,brooklyn,117 min,"drama, romance",john crowley,"saoirse ronan, emory cohen, domhnall gleeson","english, latin, irish gaelic","ireland, united kingdom, canada, united states",7.5,88.0,"154,923",tt2381111,62402155,11000000.0,4.67,no,best picture
238,tt1392190,mad max: fury road,120 min,"action, adventure, sci-fi",george miller,"tom hardy, charlize theron, nicholas hoult","english, russian","australia, united states",8.1,90.0,"1,151,388",tt1392190,380437267,150000000.0,1.54,no,best picture
239,tt3659388,the martian,144 min,"adventure, drama, sci-fi",ridley scott,"matt damon, jessica chastain, kristen wiig","english, mandarin","united states, united kingdom, hungary, jordan",8.0,80.0,"956,193",tt3659388,630621406,108000000.0,4.84,no,best picture
240,tt1663202,the revenant,156 min,"action, adventure, drama",alejandro g. iñárritu,"leonardo dicaprio, tom hardy, will poulter","english, pawnee, french","united states, hong kong, taiwan, argentina",8.0,76.0,"899,014",tt1663202,532950503,135000000.0,2.95,no,best picture
241,tt3170832,room,118 min,"drama, thriller",lenny abrahamson,"brie larson, jacob tremblay, sean bridgers",english,"ireland, canada, united kingdom, united states",8.1,86.0,"467,294",tt3170832,35402766,0.0,inf,no,best picture
242,tt1895587,spotlight,129 min,"biography, crime, drama",tom mccarthy,"mark ruffalo, michael keaton, rachel mcadams",english,united states,8.1,93.0,"514,090",tt1895587,98690254,20000000.0,3.93,yes,best picture
243,tt4302938,kubo and the two strings,101 min,"animation, action, adventure",travis knight,"charlize theron, art parkinson, matthew mcconaughey",english,"united kingdom, united states",7.7,84.0,"141,495",tt4302938,76249438,55000000.0,0.39,no,animated feature film
244,tt3521164,moana,107 min,"animation, adventure, comedy","ron clements, john musker, don hall","auli'i cravalho, dwayne johnson, rachel house","english, french",united states,7.6,81.0,"413,216",tt3521164,643332467,150000000.0,3.29,no,animated feature film
245,tt2321405,my life as a zucchini,70 min,"animation, comedy, drama",claude barras,"gaspard schlatter, sixtine murat, paulin jaccoud",french,"switzerland, france, united kingdom",7.8,85.0,"30,271",tt2321405,5873157,8000000.0,-0.27,no,animated feature film
246,tt3666024,the red turtle,80 min,"animation, drama, family",michael dudok de wit,"emmanuel garijo, tom hudson, baptiste goy",,"france, belgium, japan, united states",7.5,86.0,"40,211",tt3666024,6613503,6000000.0,0.1,no,animated feature film
247,tt2948356,zootopia,108 min,"animation, action, adventure","byron howard, rich moore, jared bush","ginnifer goodwin, jason bateman, idris elba",english,united states,8.0,78.0,"577,006",tt2948356,1025521689,150000000.0,5.84,yes,animated feature film
248,tt3841424,land of mine,100 min,"drama, history, war",martin zandvliet,"roland møller, louis hofmann, joel basman","german, danish, english","denmark, germany",7.8,75.0,"46,811",tt3841424,3169553,6000000.0,-0.47,no,foreign language film
249,tt4080728,a man called ove,116 min,"comedy, drama, romance",hannes holm,"rolf lassgård, bahar pars, filip berg","swedish, persian, spanish","sweden, denmark, norway",7.7,70.0,"71,843",tt4080728,30726624,7000000.0,3.39,no,foreign language film
250,tt5186714,the salesman,124 min,"drama, thriller",asghar farhadi,"shahab hosseini, taraneh alidoosti, babak karimi","persian, english","iran, france, qatar, united states",7.7,85.0,"66,002",tt5186714,6953604,2000000.0,2.48,yes,foreign language film
251,tt4239726,tanna,104 min,"adventure, drama, romance","martin butler, bentley dean","mungau dain, marie wawa, marceline rofit",aboriginal,"australia, vanuatu",6.9,75.0,"4,726",tt4239726,102300,0.0,inf,no,foreign language film
252,tt4048272,toni erdmann,162 min,"comedy, drama",maren ade,"sandra hüller, peter simonischek, michael wittenborn","french, german, english, romanian","germany, austria, monaco, romania, france, switzerland, belgium",7.3,93.0,"52,959",tt4048272,12002864,0.0,inf,no,foreign language film
253,tt2543164,arrival,116 min,"drama, mystery, sci-fi",denis villeneuve,"amy adams, jeremy renner, forest whitaker","english, mandarin, russian","united states, canada",7.9,81.0,"810,200",tt2543164,212758656,47000000.0,3.53,no,best picture
254,tt2671706,fences,139 min,drama,denzel washington,"denzel washington, viola davis, stephen mckinley henderson",english,"united states, canada",7.2,79.0,"121,705",tt2671706,64414761,24000000.0,1.68,no,best picture
255,tt2119532,hacksaw ridge,139 min,"biography, drama, history",mel gibson,"andrew garfield, sam worthington, luke bracey","english, japanese",united states,8.1,71.0,"630,865",tt2119532,180563636,40000000.0,3.51,no,best picture
256,tt2582782,hell or high water,102 min,"crime, drama, thriller",david mackenzie,"chris pine, ben foster, jeff bridges",english,united states,7.6,88.0,"261,534",tt2582782,37999675,12000000.0,2.17,no,best picture
257,tt4846340,hidden figures,127 min,"biography, drama, history",theodore melfi,"taraji p. henson, octavia spencer, janelle monáe",english,united states,7.8,74.0,"273,146",tt4846340,235957472,25000000.0,8.44,no,best picture
258,tt3783958,la la land,128 min,"comedy, drama, music",damien chazelle,"ryan gosling, emma stone, rosemarie dewitt","english, cantonese","united states, hong kong",8.0,94.0,"717,993",tt3783958,509183536,30000000.0,15.97,no,best picture
259,tt3741834,lion,118 min,"biography, drama",garth davis,"dev patel, nicole kidman, rooney mara","english, hindi, bengali","india, united kingdom, australia, united states",8.0,69.0,"257,764",tt3741834,140853810,12000000.0,10.74,no,best picture
260,tt4034228,manchester by the sea,137 min,drama,kenneth lonergan,"casey affleck, michelle williams, kyle chandler",english,united states,7.8,96.0,"327,412",tt4034228,78988148,8500000.0,8.29,no,best picture
261,tt4975722,moonlight,111 min,drama,barry jenkins,"mahershala ali, naomie harris, trevante rhodes",english,united states,7.4,99.0,"341,149",tt4975722,65172611,0.0,inf,yes,best picture
262,tt3874544,the boss baby,97 min,"animation, adventure, comedy",tom mcgrath,"alec baldwin, steve buscemi, jimmy kimmel","english, spanish",united states,6.3,50.0,"148,134",tt3874544,527965936,125000000.0,3.22,no,animated feature film
263,tt3901826,the breadwinner,94 min,"animation, drama, family",nora twomey,"saara chaudry, soma chhaya, noorin gulamgaus",english,"ireland, canada, luxembourg, united states, france",7.7,78.0,"29,181",tt3901826,2790214,0.0,inf,no,animated feature film
264,tt2380307,coco,105 min,"animation, adventure, drama","lee unkrich, adrian molina","anthony gonzalez, gael garcía bernal, benjamin bratt","english, spanish","united states, mexico",8.4,81.0,"645,660",tt2380307,814641172,175000000.0,3.66,yes,animated feature film
265,tt3411444,ferdinand,108 min,"animation, adventure, comedy",carlos saldanha,"john cena, kate mckinnon, bobby cannavale","english, spanish, german","united states, united kingdom, canada",6.7,58.0,"66,809",tt3411444,296069199,111000000.0,1.67,no,animated feature film
266,tt3262342,loving vincent,94 min,"animation, drama, mystery","dk welchman, hugh welchman","douglas booth, jerome flynn, robert gulaczyk",english,"poland, united kingdom, united states, switzerland, netherlands",7.8,62.0,"64,902",tt3262342,42187665,5500000.0,6.67,no,animated feature film
267,tt5639354,a fantastic woman,104 min,drama,sebastián lelio,"daniela vega, francisco reyes, luis gnecco","spanish, chinese","chile, spain, germany, united states",7.2,81.0,"28,004",tt5639354,3839364,2000000.0,0.92,yes,foreign language film
268,tt7048622,the insult,113 min,"crime, drama, thriller",ziad doueiri,"adel karam, kamel el basha, camille salameh",arabic,"france, cyprus, belgium, lebanon, united states",7.6,72.0,"18,373",tt7048622,3666268,4000000.0,-0.08,no,foreign language film
269,tt6304162,loveless,127 min,drama,andrey zvyagintsev,"maryana spivak, aleksey rozin, matvey novikov","russian, portuguese, uzbek","russia, france, germany, belgium, cyprus",7.6,86.0,"36,338",tt6304162,3928358,5000000.0,-0.21,no,foreign language film
270,tt5607714,on body and soul,116 min,"drama, fantasy, mystery",ildikó enyedi,"alexandra borbély, géza morcsányi, réka tenki",hungarian,hungary,7.5,77.0,"30,383",tt5607714,2132634,3000000.0,-0.29,no,foreign language film
271,tt4995790,the square,151 min,"comedy, drama",ruben östlund,"claes bang, elisabeth moss, dominic west","swedish, english, danish","sweden, germany, france, denmark, united states",7.1,73.0,"79,423",tt4995790,8588030,10000000.0,-0.14,no,foreign language film
272,tt5726616,call me by your name,132 min,"drama, romance",luca guadagnino,"timothée chalamet, armie hammer, michael stuhlbarg","english, italian, french, german, hebrew","brazil, france, italy, united states",7.8,94.0,"333,865",tt5726616,67446279,3500000.0,18.27,no,best picture
273,tt4555426,darkest hour,125 min,"drama, war",joe wright,"gary oldman, lily james, kristin scott thomas","english, french, german, italian","united kingdom, united states, china",7.4,75.0,"228,237",tt4555426,150847274,30000000.0,4.03,no,best picture
274,tt5013056,dunkirk,106 min,"action, drama, history",christopher nolan,"fionn whitehead, barry keoghan, mark rylance","english, french, german","united kingdom, netherlands, france, united states",7.8,94.0,"765,975",tt5013056,533696799,150000000.0,2.56,no,best picture
275,tt5052448,get out,104 min,"horror, mystery, thriller",jordan peele,"daniel kaluuya, allison williams, bradley whitford","english, swahili","united states, japan",7.8,85.0,"758,140",tt5052448,255751443,5000000.0,50.15,no,best picture
276,tt4925292,lady bird,94 min,"comedy, drama",greta gerwig,"saoirse ronan, laurie metcalf, tracy letts","english, spanish",united states,7.4,93.0,"349,400",tt4925292,78987280,10000000.0,6.9,no,best picture
277,tt5776858,phantom thread,130 min,"drama, romance",paul thomas anderson,"vicky krieps, daniel day-lewis, lesley manville","english, french","united states, china",7.4,90.0,"150,681",tt5776858,52204454,35000000.0,0.49,no,best picture
278,tt6294822,the post,116 min,"biography, drama, history",steven spielberg,"meryl streep, tom hanks, sarah paulson",english,"united states, india",7.2,83.0,"165,772",tt6294822,193764664,50000000.0,2.88,no,best picture
279,tt5580390,the shape of water,123 min,"drama, fantasy, romance",guillermo del toro,"sally hawkins, octavia spencer, michael shannon","english, american sign , russian, french","united states, mexico",7.3,87.0,"459,967",tt5580390,195243464,19500000.0,9.01,yes,best picture
280,tt5027774,"three billboards outside ebbing, missouri",115 min,"comedy, crime, drama",martin mcdonagh,"frances mcdormand, woody harrelson, sam rockwell",english,"united kingdom, united states",8.1,88.0,"574,280",tt5027774,162729321,12000000.0,12.56,no,best picture
281,tt3606756,incredibles 2,118 min,"animation, action, adventure",brad bird,"craig t. nelson, holly hunter, sarah vowell",english,"united states, japan",7.5,80.0,"348,349",tt3606756,1243225667,200000000.0,5.22,no,animated feature film
282,tt5104604,isle of dogs,101 min,"animation, adventure, comedy",wes anderson,"bryan cranston, koyu rankin, edward norton","english, japanese","united kingdom, germany, japan, united states",7.8,82.0,"199,660",tt5104604,64659098,0.0,inf,no,animated feature film
283,tt6900448,mirai,98 min,"animation, adventure, drama",mamoru hosoda,"rebecca hall, daniel dae kim, kôji yakusho","japanese, english",japan,7.0,81.0,"18,743",tt6900448,28756961,9000000.0,2.2,no,animated feature film
284,tt5848272,ralph breaks the internet,112 min,"animation, adventure, comedy","phil johnston, rich moore","john c. reilly, sarah silverman, gal gadot",english,united states,7.0,71.0,"194,435",tt5848272,529323962,175000000.0,2.02,no,animated feature film
285,tt4633694,spider-man: into the spider-verse,117 min,"animation, action, adventure","bob persichetti, peter ramsey, rodney rothman","shameik moore, jake johnson, hailee steinfeld","english, spanish","canada, united states",8.4,87.0,"727,185",tt4633694,393602435,90000000.0,3.37,yes,animated feature film
286,tt8267604,capernaum,126 min,drama,nadine labaki,"zain al rafeea, yordanos shiferaw, boluwatife treasure bankole","arabic, amharic","lebanon, united states, france, cyprus, qatar, united kingdom",8.4,75.0,"115,409",tt8267604,64417003,4000000.0,15.1,no,foreign language film
287,tt6543652,cold war,89 min,"drama, music, romance",pawel pawlikowski,"joanna kulig, tomasz kot, borys szyc","polish, french, croatian, german, russian, serbian, italian","poland, united kingdom, france, belgium, india",7.5,90.0,"63,597",tt6543652,20484802,0.0,inf,no,foreign language film
288,tt5311542,never look away,189 min,"biography, drama, romance",florian henckel von donnersmarck,"tom schilling, sebastian koch, paula beer","german, russian","germany, italy, united states",7.7,68.0,"26,792",tt5311542,6193234,30000000.0,-0.79,no,foreign language film
289,tt6155172,roma,135 min,drama,alfonso cuarón,"yalitza aparicio, marina de tavira, diego cortina autrey","spanish, mixtec, english, japanese, german, french, norwegian","mexico, united states",7.7,96.0,"173,699",tt6155172,1140769,15000000.0,-0.92,yes,foreign language film
289,tt6155172,roma,135 min,drama,alfonso cuarón,"yalitza aparicio, marina de tavira, diego cortina autrey","spanish, mixtec, english, japanese, german, french, norwegian","mexico, united states",7.7,96.0,"173,699",tt6155172,1140769,15000000.0,-0.92,no,best picture
290,tt8075192,shoplifters,121 min,"crime, drama, thriller",hirokazu koreeda,"lily franky, sakura andô, kirin kiki",japanese,japan,7.9,93.0,"89,783",tt8075192,67999348,3000000.0,21.67,no,foreign language film
291,tt1825683,black panther,134 min,"action, adventure, sci-fi",ryan coogler,"chadwick boseman, michael b. jordan, lupita nyong'o","english, swahili, nama, xhosa, korean",united states,7.3,88.0,"870,736",tt1825683,1349926083,200000000.0,5.75,no,best picture
292,tt7349662,blackkklansman,135 min,"biography, comedy, crime",spike lee,"john david washington, adam driver, laura harrier",english,"united states, china",7.5,83.0,"300,208",tt7349662,93413709,15000000.0,5.23,no,best picture
293,tt1727824,bohemian rhapsody,134 min,"biography, drama, music",bryan singer,"rami malek, lucy boynton, gwilym lee","english, british sign ","united kingdom, united states",7.9,49.0,"618,782",tt1727824,910813521,52000000.0,16.52,no,best picture
294,tt5083738,the favourite,119 min,"biography, comedy, drama",yorgos lanthimos,"olivia colman, emma stone, rachel weisz",english,"ireland, united kingdom, united states",7.5,91.0,"247,322",tt5083738,95918706,15000000.0,5.39,no,best picture
295,tt6966692,green book,130 min,"biography, comedy, drama",peter farrelly,"viggo mortensen, mahershala ali, linda cardellini","english, italian, russian, german","united states, china",8.2,69.0,"624,774",tt6966692,321752656,23000000.0,12.99,yes,best picture
296,tt1517451,a star is born,136 min,"drama, music, romance",bradley cooper,"lady gaga, bradley cooper, sam elliott","english, french",united states,7.6,88.0,"430,265",tt1517451,436433122,36000000.0,11.12,no,best picture
297,tt6266538,vice,132 min,"biography, comedy, drama",adam mckay,"christian bale, amy adams, steve carell","english, arabic",united states,7.2,61.0,"168,231",tt6266538,76073488,0.0,inf,no,best picture
298,tt2386490,how to train your dragon: the hidden world,104 min,"animation, action, adventure",dean deblois,"jay baruchel, america ferrera, f. murray abraham",english,"united states, japan",7.4,71.0,"162,927",tt2386490,539987993,129000000.0,3.19,no,animated feature film
299,tt9806192,i lost my body,81 min,"animation, drama, fantasy",jérémy clapin,"hakim faris, victoire du bois, patrick d'assumçao",french,"france, united kingdom, united states",7.5,81.0,"37,311",tt9806192,1136431,6000000.0,-0.81,no,animated feature film
300,tt4729430,klaus,96 min,"animation, adventure, comedy","sergio pablos, carlos martínez lópez","jason schwartzman, j.k. simmons, rashida jones","english, saami","spain, united kingdom, united states, austria, canada, france",8.2,65.0,"213,749",tt4729430,0,40000000.0,-1.0,no,animated feature film
301,tt6348138,missing link,93 min,"animation, adventure, comedy",chris butler,"hugh jackman, david walliams, stephen fry","english, spanish, tibetan","united states, canada, netherlands, japan",6.7,68.0,"29,773",tt6348138,26565710,100000000.0,-0.73,no,animated feature film
302,tt1979376,toy story 4,100 min,"animation, adventure, comedy",josh cooley,"tom hanks, tim allen, annie potts",english,united states,7.6,84.0,"295,159",tt1979376,1073841394,200000000.0,4.37,yes,animated feature film
303,tt8649186,corpus christi,115 min,drama,jan komasa,"bartosz bielenia, aleksandra konieczna, eliza rycembel",polish,"poland, france",7.7,77.0,"22,669",tt8649186,9943901,0.0,inf,no,international feature film
304,tt8991268,honeyland,89 min,"documentary, drama","tamara kotevska, ljubomir stefanov","hatidze muratova, nazife muratova, hussein sam","serbo-croatian, serbian, croatian, turkish, macedonian, bosnian","north macedonia, united states, switzerland",8.0,85.0,"19,657",tt8991268,1314260,500.0,2627.52,no,international feature film
305,tt10199590,les misérables,104 min,"crime, drama, thriller",ladj ly,"damien bonnard, alexis manenti, djebril zonga","french, bambara",france,7.6,78.0,"29,146",tt10199590,54606372,61000000.0,-0.1,no,international feature film
306,tt8291806,pain and glory,113 min,drama,pedro almodóvar,"antonio banderas, asier etxeandia, leonardo sbaraglia",spanish,"spain, france",7.5,87.0,"65,425",tt8291806,37359689,11000000.0,2.4,no,international feature film
307,tt6751668,parasite,132 min,"drama, thriller",bong joon ho,"song kang-ho, lee sun-kyun, cho yeo-jeong","korean, english",south korea,8.5,97.0,"1,058,893",tt6751668,262616458,11400000.0,22.04,yes,international feature film
307,tt6751668,parasite,132 min,"drama, thriller",bong joon ho,"song kang-ho, lee sun-kyun, cho yeo-jeong","korean, english",south korea,8.5,97.0,"1,058,893",tt6751668,262616458,11400000.0,22.04,yes,best picture
308,tt1950186,ford v ferrari,152 min,"action, biography, drama",james mangold,"matt damon, christian bale, jon bernthal","english, italian, french, japanese",united states,8.1,81.0,"511,816",tt1950186,226299480,97600000.0,1.32,no,best picture
